{"audit_head_hash":"e3da8739e01c40fef1ceb772c3dab33fcd0ce6037bc456521cde3903879af669","cache":{"cache_hit":false,"cache_reason":"miss_no_entry","mean_abs_diff":null,"validation_subset_size":27},"config_vector_summary":{"fixed_range_policy":"preconfigured_no_autorange","h1_subset_size":32,"h2_bins":16,"h2_max":4.0,"h2_min":0.0,"policy_version":"hashen.policy.v1"},"fixed_range":{"h2_bins":16,"h2_max":4.0,"h2_min":0.0},"inputs_summary":{},"privacy":{"consent_basis":"legitimate_interest","data_source_type":"user_provided","pii_present":"unknown"},"reason_codes":[],"retention":{"derived_ttl_days":365,"legal_hold":false,"raw_ttl_hours":24},"run_id":"example_run","schema_version":"hashen.report.v1","seal_hash":"7202dfdae25fa6082a98a592286fad404f48802ed334a06710478f12029aef5d"}